Label Value,Code,Description
Ability and Disability,940101,
Aboriginal and Torres Strait Islander Development and Welfare,940102,
Aboriginal and Torres Strait Islander Education,939901,
Aboriginal and Torres Strait Islander Health - Determinants of Health,920301,
Aboriginal and Torres Strait Islander Health - Health Status and Outcomes,920302,
Aboriginal and Torres Strait Islander Health - Health System Performance (incl. Effectiveness of Interventions),920303,
Administration and Business Support Services,900201,
Aerospace Equipment,861301,
Aerospace Transport not elsewhere classified,880399,
Ageing and Older People,940103,
Agricultural and Environmental Standards,910501,
Agricultural Chemicals not elsewhere classified,860799,
Agricultural Machinery and Equipment,861401,
Āhuatanga Māori (Māori Tradition),950301,
Air Force,810101,
Air Freight,880301,
Air Passenger Transport,880302,
Air Quality not elsewhere classified,960199,
Air Safety,880303,
Air Terminal Infrastructure and Management,880304,
Allied Health Therapies (excl. Mental Health Services),920201,
Almonds,820201,
Alumina Production,840301,
Aluminium Ore Exploration,840101,
Animal Production and Animal Primary Products not elsewhere classified,839999,
Animal Protection Chemicals,860701,
Animal Welfare,839901,
Animation and Computer Generated Imagery Services,890401,
Antarctic and Sub-Antarctic Air Quality,960101,
"Antarctic and Sub-Antarctic Flora, Fauna and Biodiversity",960801,
Antarctic and Sub-Antarctic Land and Water Management,960901,
Antarctic and Sub-Antarctic Oceanography,969901,
Appliances and Electrical Machinery and Equipment,861402,
Application Software Packages (excl. Computer Games),890201,
Application Tools and System Utilities,890202,
Aquaculture Crustaceans (excl. Rock Lobster and Prawns),830101,
Aquaculture Fin Fish (excl. Tuna),830102,
Aquaculture Molluscs (excl. Oysters),830103,
Aquaculture Oysters,830104,
Aquaculture Prawns,830105,
Aquaculture Rock Lobster,830106,
Aquaculture Tuna,830107,
Army,810102,
Arts and Leisure not elsewhere classified,950199,
Assessment and Evaluation of Curriculum,930301,
Atmosphere and Weather not elsewhere classified,960299,
Atmospheric Composition (incl. Greenhouse Gas Inventory),960201,
Atmospheric Processes and Dynamics,960202,
Automotive Equipment,861302,
Bakery Products,860101,
Balance of Payments,910101,
Barley,820501,
Basic Aluminium Products,861101,
Basic Copper Products,861102,
Basic Iron and Steel Products,861103,
"Basic Metal Products (incl. Smelting, Rolling, Drawing and Extruding) not elsewhere classified",861199,
Basic Precious Metal Products,861104,
Basic Zinc Products,861105,
Beef Cattle,830301,
Behaviour and Health,920401,
Beneficiation of Bauxite and Aluminium Ores (excl. Alumina Production),840302,
Beneficiation or Dressing of Iron Ores,840303,
Beneficiation or Dressing of Non-Metallic Minerals (incl. Diamonds),840304,
Berry Fruit (excl. Kiwifruit),820202,
Beverages (excl. Fruit Juices),860102,
Bioethics,950401,
Biofuel (Biomass) Energy,850501,
Blood Disorders,920101,
Border Biosecurity (incl. Quarantine and Inspection),960401,
Browse Crops,830401,
Building Management and Services not elsewhere classified,870599,
Business Ethics,950402,
Butter and Milk-Derived Fats and Oils (excl. Cream),860201,
Cancer and Related Disorders,920102,
Canola,820502,
Carbon and Emissions Trading,919901,
Carcass Meat (incl. Fish and Seafood),860103,
Cardiovascular System and Diseases,920103,
Carer Health,920202,
Carers' Development and Welfare,940104,
Casein,860202,
Cement and Concrete Materials,870301,
Cement Products and Concrete Materials,861001,
Ceramics,861002,
"Ceramics, Glass and Industrial Mineral Products not elsewhere classified",861099,
Cheese,860203,
Chemical Fertilisers,860702,
Child Health,920501,
Children's/Youth Services and Childcare,940105,
Citizenship and National Identity,940106,
Citrus Fruit,820203,
Civics and Citizenship,940201,
Civil Building Management and Services,870501,
Civil Construction Design,870201,
Civil Construction Planning,870101,
Civil Construction Processes,870401,
Civil Justice,940401,
Clay Products,861003,
Climate and Climate Change not elsewhere classified,960399,
Climate Change Adaptation Measures,960301,
Climate Change Mitigation Strategies,960302,
Climate Change Models,960303,
Climate Variability (excl. Social Impacts),960304,
"Clinical Health (Organs, Diseases and Abnormal Conditions) not elsewhere classified",920199,
Clothing,860401,
Coal Exploration,850101,
Coal Mining and Extraction,850201,
Coastal and Estuarine Air Quality,960102,
"Coastal and Estuarine Flora, Fauna and Biodiversity",960802,
Coastal and Estuarine Land Management,960902,
Coastal and Estuarine Soils,961401,
Coastal and Estuarine Water Management,960903,
Coastal and Marine Management Policy,960701,
Coastal Sea Freight Transport,880201,
Coated Metal and Metal-Coated Products,861201,
"Command, Control and Communications",810103,
Commercial Building Management and Services,870502,
Commercial Construction Design,870202,
Commercial Construction Planning,870102,
Commercial Construction Processes,870402,
Commercial Energy Conservation and Efficiency,850701,
Commercial Services and Tourism not elsewhere classified,909999,
Communication Across Languages and Culture,950201,
Communication Equipment not elsewhere classified,861799,
Communication Networks and Services not elsewhere classified,890199,
Communication not elsewhere classified,950299,
Community Service (excl. Work) not elsewhere classified,940199,
Comparative Structure and Development of Community Services,940107,
Computer and Electronic Office Equipment,861601,
Computer Gaming Software,890203,
Computer Hardware and Electronic Equipment not elsewhere classified,861699,
Computer Software and Services not elsewhere classified,890299,
"Computer Time Leasing, Sharing and Renting Services",890204,
Concentrating Processes of Base Metal Ores (excl. Aluminium and Iron Ores),840305,
Conserving Aboriginal and Torres Strait Islander Heritage,950302,
Conserving Collections and Movable Cultural Heritage,950303,
Conserving Intangible Cultural Heritage,950304,
Conserving Natural Heritage,950305,
Conserving Pacific Peoples Heritage,950306,
Conserving the Historic Environment,950307,
Construction Design not elsewhere classified,870299,
Construction Materials Performance and Processes not elsewhere classified,870399,
Construction not elsewhere classified,879999,
Construction Planning not elsewhere classified,870199,
Construction Processes not elsewhere classified,870499,
Consumer Electronic Equipment (excl. Communication Equipment),861602,
Consumption,910201,
"Consumption Patterns, Population Issues and the Environment",960702,
"Control of Animal Pests, Diseases and Exotic Species in Coastal and Estuarine Environments",960402,
"Control of Animal Pests, Diseases and Exotic Species in Farmland, Arable Cropland and Permanent Cropland Environments",960403,
"Control of Animal Pests, Diseases and Exotic Species in Forest and Woodlands Environments",960404,
"Control of Pests, Diseases and Exotic Species at Regional or Larger Scales",960405,
"Control of Pests, Diseases and Exotic Species in Fresh, Ground and Surface Water Environments",960406,
"Control of Pests, Diseases and Exotic Species in Marine Environments",960407,
"Control of Pests, Diseases and Exotic Species in Mining Environments",960408,
"Control of Pests, Diseases and Exotic Species in Mountain and High Country Environments",960409,
"Control of Pests, Diseases and Exotic Species in Sparseland, Permanent Grassland and Arid Zone Environments",960410,
"Control of Pests, Diseases and Exotic Species in Urban and Industrial Environments",960411,
"Control of Pests, Diseases and Exotic Species not elsewhere classified",960499,
"Control of Plant Pests, Diseases and Exotic Species in Coastal and Estuarine Environments",960412,
"Control of Plant Pests, Diseases and Exotic Species in Farmland, Arable Cropland and Permanent Cropland Environments",960413,
"Control of Plant Pests, Diseases and Exotic Species in Forest and Woodlands Environments",960414,
Copper Ore Exploration,840102,
Cotton,820301,
Cotton Ginning,860402,
Cotton Lint and Cotton Seed,820601,
Crime Prevention,940402,
Criminal Justice,940403,
Crop Protection Chemicals,860703,
Cultural Understanding not elsewhere classified,959999,
Curriculum not elsewhere classified,930399,
Dairy Cattle,830302,
Dairy Products not elsewhere classified,860299,
Deer,830303,
Defence and Security Policy,940301,
Defence not elsewhere classified,810199,
Defence Standards and Calibrations,910502,
Demography,910102,
Dental Health,920402,
Diabetes,920104,
Diagnostic Methods,920203,
Diamond Exploration,840103,
Digestive System Disorders,920105,
Disability and Functional Capacity,920403,
Disease Distribution and Transmission (incl. Surveillance and Response),920404,
Distribution of Income and Wealth,940108,
Documentation of Undescribed Flora and Fauna,960803,
Ecological Economics,919902,
Economic Framework not elsewhere classified,919999,
Economic Growth,910103,
Economic Incentives for Environmental Protection,960601,
Economic Issues in Tourism,900301,
Ecosystem Adaptation to Climate Change,960305,
Ecosystem Assessment and Management at Regional or Larger Scales,960501,
Ecosystem Assessment and Management not elsewhere classified,960599,
Ecosystem Assessment and Management of Antarctic and Sub-Antarctic Environments,960502,
Ecosystem Assessment and Management of Coastal and Estuarine Environments,960503,
"Ecosystem Assessment and Management of Farmland, Arable Cropland and Permanent Cropland Environments",960504,
Ecosystem Assessment and Management of Forest and Woodlands Environments,960505,
"Ecosystem Assessment and Management of Fresh, Ground and Surface Water Environments",960506,
Ecosystem Assessment and Management of Marine Environments,960507,
Ecosystem Assessment and Management of Mining Environments,960508,
Ecosystem Assessment and Management of Mountain and High Country Environments,960509,
"Ecosystem Assessment and Management of Sparseland, Permanent Grassland and Arid Zone Environments",960510,
Ecosystem Assessment and Management of Urban and Industrial Environments,960511,
Eco-Verification (excl. Environmental Lifecycle Assessment),960602,
Education and Training not elsewhere classified,939999,
Education and Training Systems not elsewhere classified,930599,
Education and Training Systems Policies and Development,930501,
Education and Training Theory and Methodology,939902,
Effects of Climate Change and Variability on Antarctic and Sub-Antarctic Environments (excl. Social Impacts),960306,
Effects of Climate Change and Variability on Australia (excl. Social Impacts),960307,
Effects of Climate Change and Variability on New Zealand (excl. Social Impacts),960308,
Effects of Climate Change and Variability on the South Pacific (excl. Australia and New Zealand) (excl. Social Impacts),960309,
Eggs,830501,
Electoral Systems,940202,
Electronic Information Storage and Retrieval Services,890301,
Emerging Defence Technologies,810104,
Employment Patterns and Change,940501,
Employment Services,940109,
Endocrine Organs and Diseases (excl. Diabetes),920106,
Energy Conservation and Efficiency in Transport,850702,
Energy Conservation and Efficiency not elsewhere classified,850799,
Energy Exploration not elsewhere classified,850199,
Energy not elsewhere classified,859999,
Energy Services and Utilities,850601,
Energy Storage (excl. Hydrogen),850602,
"Energy Storage, Distribution and Supply not elsewhere classified",850699,
Energy Systems Analysis,850603,
Energy Transformation not elsewhere classified,850499,
Energy Transmission and Distribution (excl. Hydrogen),850604,
Environment not elsewhere classified,969999,
Environmental and Natural Resource Evaluation not elsewhere classified,960699,
Environmental Education and Awareness,960703,
Environmental Ethics,950403,
Environmental Health,920405,
Environmental Lifecycle Assessment,960603,
Environmental Management Systems,960604,
"Environmental Policy, Legislation and Standards not elsewhere classified",960799,
Environmental Services,940110,
Environmentally Sustainable Animal Production not elsewhere classified,839899,
Environmentally Sustainable Commercial Services and Tourism not elsewhere classified,909899,
Environmentally Sustainable Construction not elsewhere classified,879899,
Environmentally Sustainable Energy Activities not elsewhere classified,859899,
Environmentally Sustainable Information and Communication Services not elsewhere classified,899899,
Environmentally Sustainable Manufacturing not elsewhere classified,869899,
Environmentally Sustainable Mineral Resource Activities not elsewhere classified,849899,
Environmentally Sustainable Plant Production not elsewhere classified,829899,
Environmentally Sustainable Transport not elsewhere classified,889899,
Equity and Access to Education,939903,
"Essential Oil Crops (e.g. Tea Tree, Eucalyptus, Lavender, Peppermint, Boronia, Sandalwood)",820302,
"Essential Oils (e.g. Tea Tree, Eucalyptus, Lavender, Peppermint, Boronia, Sandalwood)",860301,
"Ethnicity, Multiculturalism and Migrant Development and Welfare",940111,
Evaluation of Health Outcomes,920204,
Exchange Rates,910104,
Expanding Knowledge in Built Environment and Design,970112,
"Expanding Knowledge in Commerce, Management, Tourism and Services",970115,
Expanding Knowledge in Economics,970114,
Expanding Knowledge in Education,970113,
Expanding Knowledge in Engineering,970109,
Expanding Knowledge in History and Archaeology,970121,
"Expanding Knowledge in Language, Communication and Culture",970120,
Expanding Knowledge in Law and Legal Studies,970118,
Expanding Knowledge in Philosophy and Religious Studies,970122,
Expanding Knowledge in Psychology and Cognitive Sciences,970117,
Expanding Knowledge in Technology,970110,
Expanding Knowledge in the Agricultural and Veterinary Sciences,970107,
Expanding Knowledge in the Biological Sciences,970106,
Expanding Knowledge in the Chemical Sciences,970103,
Expanding Knowledge in the Earth Sciences,970104,
Expanding Knowledge in the Environmental Sciences,970105,
Expanding Knowledge in the Information and Computing Sciences,970108,
Expanding Knowledge in the Mathematical Sciences,970101,
Expanding Knowledge in the Medical and Health Sciences,970111,
Expanding Knowledge in the Physical Sciences,970102,
Expanding Knowledge through Studies of Human Society,970116,
Expanding Knowledge through Studies of the Creative Arts and Writing,970119,
Fabricated Metal Products not elsewhere classified,861299,
Families and Family Services,940112,
"Farmland, Arable Cropland and Permanent Cropland Air Quality",960103,
"Farmland, Arable Cropland and Permanent Cropland Flora, Fauna and Biodiversity",960804,
"Farmland, Arable Cropland and Permanent Cropland Land Management",960904,
"Farmland, Arable Cropland and Permanent Cropland Soils",961402,
"Farmland, Arable Cropland and Permanent Cropland Water Management",960905,
Film and Video Services (excl. Animation and Computer Generated Imagery),890402,
Finance Services,900101,
Financial Services not elsewhere classified,900199,
First Stage Treatment of Ores and Minerals not elsewhere classified,840399,
Fiscal Policy,910105,
Fish Product Traceability and Quality Assurance,839902,
Fisheries - Aquaculture not elsewhere classified,830199,
Fisheries - Recreational,830201,
Fisheries - Wild Caught not elsewhere classified,830299,
Fixed Line Data Networks and Services,890101,
Fixed Line Telephone Networks and Services,890102,
"Flora, Fauna and Biodiversity at Regional or Larger Scales",960805,
"Flora, Fauna and Biodiversity of environments not elsewhere classified",960899,
Flour Mill and Cereal Food,860104,
Food Safety,920406,
"Forest and Woodlands Flora, Fauna and Biodiversity",960806,
Forest and Woodlands Land Management,960906,
Forest and Woodlands Soils,961403,
Forest and Woodlands Water Management,960907,
Forest Product Traceability and Quality Assurance,829901,
Forestry not elsewhere classified,820199,
Fresh Fruits and Vegetables (Post Harvest),820602,
"Fresh, Ground and Surface Water Flora, Fauna and Biodiversity",960807,
Fuel Cells (excl. Solid Oxide),850401,
Furniture,869901,
"Game Livestock (e.g. Kangaroos, Wallabies, Camels, Buffaloes, Possums)",830305,
Gender and Sexualities,940113,
Gender Aspects of Education,939904,
Geothermal Energy,850502,
Geothermal Energy Extraction,850202,
Geothermal Exploration,850102,
"Global Effects of Climate Change and Variability (excl. Australia, New Zealand, Antarctica and the South Pacific) (excl. Social Impacts)",960310,
Goats,830304,
Government and Politics not elsewhere classified,940299,
Grain Legumes,820503,
Ground Transport not elsewhere classified,880199,
Hardwood Plantations,820101,
Harvesting and Packing of Plant Products not elsewhere classified,820699,
Harvesting and Transport of Forest Products,820102,
Health and Support Services not elsewhere classified,920299,
Health Education and Promotion,920205,
Health Inequalities,920206,
Health not elsewhere classified,929999,
Health Policy Economic Outcomes,920207,
Health Policy Evaluation,920208,
Health Protection and/or Disaster Response,920407,
Health Related to Ageing,920502,
Health Related to Specific Ethnic Groups,920503,
Health Status (e.g. Indicators of Well-Being),920408,
"Hearing, Vision, Speech and Their Disorders",920107,
Heritage not elsewhere classified,950399,
Honey,830502,
Hops,820204,
Horses,830306,
Horticultural Crops not elsewhere classified,820299,
Hospitality Services,909901,
Human Biological Preventatives (e.g. Vaccines),860801,
Human Capital Issues,910202,
Human Diagnostics,860802,
Human Pharmaceutical Products not elsewhere classified,860899,
Human Pharmaceutical Treatments (e.g. Antibiotics),860803,
Hydro-Electric Energy,850503,
Hydrogen Distribution,850605,
Hydrogen Production from Fossil Fuels,850301,
Hydrogen Production from Nuclear Energy,850302,
Hydrogen Production from Renewable Energy,850303,
Hydrogen Storage,850606,
Hydrogen-based Energy Systems (incl. Internal Hydrogen Combustion Engines),850402,
Immune System and Allergy,920108,
Income Distribution,910106,
Indigenous Health not elsewhere classified,920399,
Industrial Chemicals and Related Products not elsewhere classified,860699,
Industrial Construction Design,870203,
Industrial Construction Processes,870403,
Industrial Crops not elsewhere classified,820399,
Industrial Energy Conservation and Efficiency,850703,
Industrial Gases,860601,
Industrial Instruments,861501,
Industrial Machinery and Equipment,861403,
Industrial Organisations,910203,
Industrial Relations,910401,
Industry Costs and Structure,910204,
Industry Policy,910205,
Infectious Diseases,920109,
Information and Communication Services not elsewhere classified,899999,
Information Processing Services (incl. Data Entry and Capture),890205,
Information Services not elsewhere classified,890399,
Inherited Diseases (incl. Gene Therapy),920110,
Injury Control,920409,
Inorganic Industrial Chemicals,860602,
Institutional Arrangements for Environmental Protection,960605,
Instrumentation not elsewhere classified,861599,
Integrated Circuits and Devices,861603,
Integrated Systems,861604,
Integration of Farm and Forestry,820103,
Intelligence,810105,
Intermodal Materials Handling,889901,
International Agreements on Trade,910301,
International Aid and Development,940302,
International Organisations,940303,
International Political Economy (excl. International Trade),940304,
International Relations not elsewhere classified,940399,
International Sea Freight Transport (excl. Live Animal Transport),880202,
International Sea Transport of Live Animals,880203,
International Trade not elsewhere classified,910399,
Internet Broadcasting,890403,
Internet Hosting Services (incl. Application Hosting Services),890206,
Investment Services (excl. Superannuation),900102,
Iron Ore Exploration,840104,
Justice and the Law not elsewhere classified,940499,
Kiwifruit,820205,
Land and Water Management of environments not elsewhere classified,960999,
Land Stewardship,960704,
Languages and Literacy,950202,
Languages and Literature,950203,
Law Enforcement,940404,
Law Reform,940405,
"Law, Politics and Community Services not elsewhere classified",949999,
Learner and Learning Achievement,930101,
Learner and Learning not elsewhere classified,930199,
Learner and Learning Processes,930102,
Learner Development,930103,
"Leather Products, Fibre Processing and Textiles not elsewhere classified",860499,
Legal Processes,940406,
"Legislation, Civil and Criminal Codes",940407,
Library and Archival Services,890302,
Linseed,820504,
Live Animals,830503,
Livestock Product Traceability and Quality Assurance,839903,
Livestock Raising not elsewhere classified,830399,
Logistics,810106,
Lubricants,860603,
Lucerne,830402,
Lupins,820505,
Macadamias,820206,
Machined Metal Products,861202,
Machinery and Equipment not elsewhere classified,861499,
Macro Labour Market Issues,910107,
Macroeconomics not elsewhere classified,910199,
Maize,820401,
Management,910402,
Management and Leadership of Schools/Institutions,930401,
Management and Productivity not elsewhere classified,910499,
Management of Education and Training Systems,930502,
Management of Gaseous Waste from Animal Production (excl. Greenhouse Gases),839801,
Management of Gaseous Waste from Commercial Services and Tourism (excl. Greenhouse Gases),909801,
Management of Gaseous Waste from Construction Activities (excl. Greenhouse Gases),879801,
Management of Gaseous Waste from Energy Activities (excl. Greenhouse Gases),859801,
Management of Gaseous Waste from Manufacturing Activities (excl. Greenhouse Gases),869801,
Management of Gaseous Waste From Mineral Resource Activities (excl. Greenhouse Gases),849801,
Management of Gaseous Waste from Plant Production (excl. Greenhouse Gases),829801,
Management of Gaseous Waste from Transport Activities (excl. Greenhouse Gases),889801,
Management of Greenhouse Gas Emissions from Animal Production,839802,
Management of Greenhouse Gas Emissions from Commercial Services and Tourism,909802,
Management of Greenhouse Gas Emissions from Construction Activities,879802,
Management of Greenhouse Gas Emissions from Electricity Generation,859802,
Management of Greenhouse Gas Emissions from Energy Activities (excl. Electricity Generation),859803,
Management of Greenhouse Gas Emissions from Information and Communication Services,899801,
Management of Greenhouse Gas Emissions from Manufacturing Activities,869802,
Management of Greenhouse Gas Emissions from Mineral Resource Activities,849802,
Management of Greenhouse Gas Emissions from Plant Production,829802,
Management of Greenhouse Gas Emissions from Transport Activities,889802,
Management of Liquid Waste from Animal Production (excl. Water),839803,
Management of Liquid Waste from Commercial Services and Tourism (excl. Water),909803,
Management of Liquid Waste from Construction Activities (excl. Water),879803,
Management of Liquid Waste from Energy Activities (excl. Water),859804,
Management of Liquid Waste from Manufacturing Activities (excl. Water),869803,
Management of Liquid Waste from Mineral Resource Activities (excl. Water),849803,
Management of Liquid Waste from Plant Production (excl. Water),829803,
Management of Liquid Waste from Transport Activities (excl. Water),889803,
Management of Noise and Vibration from Transport Activities,889804,
Management of Solid Waste from Animal Production,839804,
Management of Solid Waste from Commercial Services and Tourism,909804,
Management of Solid Waste from Construction Activities,879804,
Management of Solid Waste from Energy Activities,859805,
Management of Solid Waste from Information and Communication Services,899802,
Management of Solid Waste from Manufacturing Activities,869804,
Management of Solid Waste from Mineral Resource Activities,849804,
Management of Solid Waste from Plant Production,829804,
Management of Solid Waste from Transport Activities,889805,
Management of Water Consumption by Animal Production,839805,
Management of Water Consumption by Commercial Services and Tourism,909805,
Management of Water Consumption by Construction Activities,879805,
Management of Water Consumption by Energy Activities,859806,
Management of Water Consumption by Information and Communication Services,899803,
Management of Water Consumption by Manufacturing Activities,869805,
Management of Water Consumption by Mineral Resource Activities,849805,
Management of Water Consumption by Plant Production,829805,
Management of Water Consumption by Transport Activities,889806,
Manufacturing not elsewhere classified,869999,
Manufacturing Standards and Calibrations,910503,
Maori Development and Welfare,940114,
Maori Education,939905,
Maori Health - Determinants of Health,920304,
Maori Health - Health Status and Outcomes,920305,
Maori Health - Health System Performance (incl. Effectiveness of Interventions),920306,
Marine Air Quality,960104,
"Marine Flora, Fauna and Biodiversity",960808,
Marine Oceanic Processes (excl. climate related),969902,
Market-Based Mechanisms,910206,
Marketing,910403,
Mātauranga Māori (Māori Knowledge),950308,
Measurement Standards and Calibration Services not elsewhere classified,910599,
Media Services not elsewhere classified,890499,
Medical Instruments,861502,
Men's Health,920504,
Mental Health,920410,
Mental Health Services,920209,
Metal Castings,861203,
"Metals (e.g. Composites, Coatings, Bonding)",870302,
Micro Labour Market Issues,910208,
Microeconomic Effects of Taxation,910207,
Microeconomics not elsewhere classified,910299,
Mineral Exploration not elsewhere classified,840199,
Mineral Resources (excl. Energy Resources) not elsewhere classified,849999,
Mining Air Quality,960105,
Mining and Extraction of Aluminium Ores,840201,
Mining and Extraction of Copper Ores,840202,
Mining and Extraction of Diamonds,840203,
Mining and Extraction of Energy Resources not elsewhere classified,850299,
